keyword,title,url,abstract,authors,citations
artificial intelligence,Study on the Application Fields and Development Prospects of Artificial Intelligence,https://ieeexplore.ieee.org/document/9534575/,"Since the world entered the Internet age, various industries have developed rapidly, as has the industry of [::artificial::] [::intelligence::]. Moreover, there is a wide range of application areas in [::artificial::] [::intelligence::], including industry, computer, education, and intelligent robots. With the rapid development of science and technology, it is believed that the [::artificial::] [:...","Li Xiaojun, Zhuo Xiande, Zhu Kexi, Deng Zhenli, Zhang Kai, Wang Xi",Not Available
artificial intelligence,Artificial intelligence and modern sports education technology,https://ieeexplore.ieee.org/document/5641441/,"[::Artificial::] [::intelligence::] is a comprehensive cutting-edge discipline which is developing, and an important research direction in the fields of science computer and technology. This paper uses the principles and methods of [::artificial::] [::intelligence::] on the basis of describing the concept and research areas of [::artificial::] [::intelligence::], focuses on in-depth analysis and d...",Liu Xian,Not Available
artificial intelligence,The Influence and Application of Artificial Intelligence on the Political Development of New Media in China,https://ieeexplore.ieee.org/document/9516500/,"At present, in the field of [::artificial::] [::intelligence::], China and the United States are not only engaged in technological competition, but also in a political war. China’s ideology makes Chinese people accustomed to giving up part of the right of privacy in order to get better public services, and [::artificial::] [::intelligence::] just needs a huge database. Therefore, the government ca...",Yuyu Zheng,Not Available
artificial intelligence,Research and Application of Artificial Intelligence and Big Data in Infectious Disease Prevention and Control,https://ieeexplore.ieee.org/document/10604633/,"With the continuous spread and globalization of infectious diseases, infectious disease prevention and control has become an important task for both countries and the world. Traditional infectious disease monitoring methods often rely on manual collection and analysis of data, which is inefficient and easily limited by human errors. However, the development of [::artificial::] [::intelligence::] a...","Xiaoqing Tang, Xiupeng Yan, Junbiao Chang, Minghui Zhao",Not Available
artificial intelligence,Application of Artificial Intelligence and Virtual Reality Technology in the Construction of University Physical Education,https://ieeexplore.ieee.org/document/9750820/,"The progress of [::artificial::] [::intelligence::] and virtual reality technology has provided convenience to all sectors of the society. With the support of the core algorithm of [::artificial::] [::intelligence::], technicians can develop, design and optimize [::artificial::] [::intelligence::] systems so that they can have [::intelligence::] similar to the human brain and simulate human intell...",Nan Wang,Not Available
artificial intelligence,Risks and Countermeasures of Artificial Intelligence for College Students' Growth,https://ieeexplore.ieee.org/document/10277729/,"With the development of the times, [::artificial::] [::intelligence::] is also rapidly updating, bringing great convenience to people&#39;s lives, but also bringing many risks and challenges to college students. Currently, under the impact of [::artificial::] [::intelligence::], college students are facing risks such as weakening their dominant position, obliterating value consensus, and reducing inno...","Yuanpeng Duan, Chengping Dong",Not Available
artificial intelligence,Analysis of Systematic Reform of Future Teaching in the Age of Artificial Intelligence,https://ieeexplore.ieee.org/document/9534529/,"[::Artificial::] [::intelligence::] has developed rapidly in recent years, which not only brings convenience to people’s lives, but also plays an important role in education. In the past, teachers mainly relied on relevant teaching materials to prepare lessons, but now teachers can use [::artificial::] [::intelligence::] technology to prepare lessons, which reduces the burden of preparing lessons ...","Wang Caijun, Jin Xi, Zheng Zhenzhou",Not Available
artificial intelligence,Artificial Intelligence Techniques to Revolutionize the Marketing Strategies for Enormous Business Expansion,https://ieeexplore.ieee.org/document/10370805/,"[::Artificial::] [::intelligence::] (AI) is a rapidly growing field. It&#39;s the most recent technological disruptor with enormous marketing transformation potential. Experts from all over the world are working hard to find the best AI solutions for their marketing departments. The world is fast transitioning to a digital era, as is well acknowledged. The smart-marketing firms, which incorporate AI t...","K. Vijay Chandra, K. Sudha Rani, Palak Singh, C. V. Rambabu, K. Vidya Sagar, Poornaiah Billa",Not Available
artificial intelligence,Empowering Education Through Transformative Role of Artificial Intelligence (AI) in Teaching and Learning: Educators' Perspective and Research Trends,https://ieeexplore.ieee.org/document/10809596/,"This research study explores the transformative role of [::Artificial::] [::Intelligence::] (AI) in education. Utilizing a mixed-methods approach, the study combines qualitative data collection techniques and document analysis to determine AI integration in educational settings as perceived by the Open University Systems graduate students who are teachers by profession. Through semi-structured int...",Caren Casama Orlanda-Ventayen,Not Available
